{
  "contract": {
    "id": "CT-PUB-001",
    "version": "1.0.0"
  },
  "package_id": "PKG-2026-000001",
  "request_id": "REQ-2026-000001",
  "approved_draft_id": "DRF-2026-000001",
  "approved_draft_version": "1.0.0",
  "publish_decision": "publish_ready",
  "article_content": "完成記事",
  "seo_metadata": {
    "seo_title": "SEOタイトル",
    "meta_description": "説明",
    "h1": "H1"
  },
  "output_format": "hatena_html",
  "quality_summary": {},
  "remaining_advisories": [],
  "generated_at": "2026-07-16T20:45:00+09:00"
}